{
  "$schema": "https://json-schema.org/draft/2020-12/schema",
  "$id": "https://raw.githubusercontent.com/fabkho/the-i18n-mcp/main/schema.json",
  "title": "the-i18n-mcp project configuration",
  "description": "Configuration file for the-i18n-mcp MCP server. Place as .i18n-mcp.json at your project root (next to nuxt.config.ts or artisan). All fields are optional — the server passes them to the AI agent as context for translation workflows.",
  "type": "object",
  "additionalProperties": false,
  "properties": {
    "$schema": {
      "type": "string",
      "description": "Path or URL to the JSON schema for IDE autocompletion."
    },
    "context": {
      "type": "string",
      "description": "Free-form project background for the agent — business domain, user base, brand voice, anything that helps the agent understand the project."
    },
    "layerRules": {
      "type": "array",
      "description": "Rules that help the agent decide which layer a new translation key belongs to. The agent interprets the natural-language 'when' field.",
      "items": {
        "type": "object",
        "additionalProperties": false,
        "required": [
          "layer",
          "description",
          "when"
        ],
        "properties": {
          "layer": {
            "type": "string",
            "description": "Layer name (e.g., 'root', 'app-admin', 'app-shop', 'lang')."
          },
          "description": {
            "type": "string",
            "description": "What this layer contains — key namespaces, domain scope, etc."
          },
          "when": {
            "type": "string",
            "description": "Natural-language rule describing when a key should go in this layer."
          }
        }
      }
    },
    "glossary": {
      "type": "object",
      "description": "Term dictionary for consistent translations. Keys are source terms, values describe the required translation or usage note.",
      "additionalProperties": {
        "type": "string"
      }
    },
    "translationPrompt": {
      "type": "string",
      "description": "System prompt prepended to all translation requests (both MCP sampling and agent-inline fallback). Sets tone, style, and constraints."
    },
    "localeNotes": {
      "type": "object",
      "description": "Per-locale context included in translation prompts. Keys are locale codes (e.g., 'de-DE', 'en-US', 'de-DE-formal'), values describe register, regional conventions, or other locale-specific guidance.",
      "additionalProperties": {
        "type": "string"
      }
    },
    "examples": {
      "type": "array",
      "description": "Few-shot translation examples that demonstrate the project's style. The agent uses these as reference when generating translations.",
      "items": {
        "type": "object",
        "description": "A single translation example. Must have a 'key' property. All other properties are locale codes (e.g., 'de-DE', 'en-US') mapped to their translated value, or 'note' with a style comment.",
        "required": [
          "key"
        ],
        "properties": {
          "key": {
            "type": "string",
            "description": "The dot-path translation key (e.g., 'common.actions.save')."
          },
          "note": {
            "type": "string",
            "description": "Optional style or context note about this example."
          }
        },
        "additionalProperties": {
          "type": "string"
        }
      }
    },
    "orphanScan": {
      "type": "object",
      "description": "Per-layer scan directories for orphan key detection. In monorepos, a shared layer's keys may be used across multiple apps. Map each layer name to the directories that should be scanned for its key usage. Paths are relative to the project root.",
      "additionalProperties": {
        "type": "object",
        "required": ["scanDirs"],
        "properties": {
          "scanDirs": {
            "type": "array",
            "description": "Directories to scan for key usage (relative to project root).",
            "items": {
              "type": "string"
            }
          },
          "ignorePatterns": {
            "type": "array",
            "description": "Glob patterns for translation keys to exclude from orphan detection (e.g., \"common.datetime.months.*\"). Use * to match a single key segment, ** to match any depth.",
            "items": {
              "type": "string"
            }
          }
        },
        "additionalProperties": false
      }
    },
    "samplingPreferences": {
      "type": "object",
      "description": "Model preferences for translate_missing sampling requests. Overrides the built-in defaults which favor fast, cheap models (Gemini Flash, Claude Haiku, etc.). The MCP host (VS Code, Cursor, etc.) uses these hints to pick a model — all fields are advisory.",
      "additionalProperties": false,
      "properties": {
        "hints": {
          "type": "array",
          "description": "Ordered model name hints (substring match). The host evaluates in order and takes the first match. Example: [\"flash\", \"haiku\", \"gpt-4o-mini\"].",
          "items": {
            "type": "string"
          }
        },
        "costPriority": {
          "type": "number",
          "minimum": 0,
          "maximum": 1,
          "description": "How much to prioritize cost. 0 = don't care, 1 = most important factor."
        },
        "speedPriority": {
          "type": "number",
          "minimum": 0,
          "maximum": 1,
          "description": "How much to prioritize speed/latency. 0 = don't care, 1 = most important factor."
        },
        "intelligencePriority": {
          "type": "number",
          "minimum": 0,
          "maximum": 1,
          "description": "How much to prioritize intelligence/capabilities. 0 = don't care, 1 = most important factor."
        }
      }
    },
    "reportOutput": {
      "oneOf": [
        {
          "type": "string",
          "description": "Custom directory path (relative to project root) where diagnostic tool reports are written."
        },
        {
          "type": "boolean",
          "const": true,
          "description": "Set to true to write reports to the default '.i18n-reports/' directory."
        }
      ],
      "description": "Enable file output for diagnostic tools (get_missing_translations, find_empty_translations, find_orphan_keys, scan_code_usage, cleanup_unused_translations). When set, each tool writes its full JSON report to <reportOutput>/<toolName>.json and returns only a summary in the MCP response. Set to true for the default '.i18n-reports/' directory, or a string for a custom path."
    }
  }
}
